id,name,description,ean,upc,net_price,taxes,price,created_ts
1,Soluta qui ipsam non ipsum.,Est ducimus temporibus modi saepe architecto unde. Dicta eveniet exercitationem aut porro sed magni. Sit vitae voluptas sint non voluptates ut. Quos qui illo error nihil laborum vero.,9275085786366,678836676322,73.94,12.0,82.81,2024-03-07 14:57:46.317093+00:00
2,Mollitia unde id in.,Consectetur odio facere odio modi. Dicta ipsa temporibus sit facere cupiditate doloremque odio. Asperiores quaerat eius accusamus sint. Earum ut consequatur facilis molestias.,7742954627423,868660253050,47.84,12.0,53.56,2024-03-07 14:57:46.317093+00:00
3,Non maiores non omnis aut.,Ea porro blanditiis eos enim non. Quas sunt eligendi sapiente et et fuga recusandae voluptatem. Enim quae voluptas assumenda dolore. Nisi a aut architecto et.,2512320523865,177553157885,73.12,12.0,81.94,2024-03-07 14:57:46.317093+00:00
4,Dolorum ad in et fugit.,Accusantium eveniet rerum architecto commodi est omnis. Eum sit hic voluptatum quis debitis et. Qui vel debitis qui ipsum.,8202786584879,196448101021,58.0,12.0,65.0,2024-03-07 14:57:46.317093+00:00
5,Nesciunt eius est minus quis.,Blanditiis architecto magni deserunt ad cupiditate soluta dicta. Vel accusamus rerum vel fuga quo incidunt aperiam. Unde ut ullam dolores ut. Et ratione voluptate consequatur architecto iure placeat.,8209547367290,377128338181,75.06,12.0,84.06,2024-03-07 14:57:46.317093+00:00
